{
  "$schema_version": "1.1.0",
  "asset_name": "lexical-tables",
  "description": "Consolidated deterministic lexical-substitution layer migrated from arabic-ai-text-humanizer. v1.1.0 (toolkit v0.7.1) brings the asset to parity with humanize_v2.py — earlier v1.0.0 was migrated from the references/13 documentation, which had fallen behind the live code. Each sub-table declares its own substitution policy so consumers can apply identical semantics without re-reading the original Python.",
  "provenance": {
    "source_repo": "arabic-ai-text-humanizer",
    "source_file_v1.0.0": "references/13-inherited-lexical-tables.md (stale documentation)",
    "source_file_v1.1.0": "scripts/humanize_v2.py lines 51-209 (live code, v2.7.0 release)",
    "source_release": "v2.7.0",
    "v1_substrate_origin": "predecessor lexical-only Arabic humanizer (referenced as 'v1' in source)",
    "extensions_origin": "corpus mining (Gaps A-G) + cross-LLM critique (newsroom AI-tells) + ChatGPT-deep-research findings (clause-preserving variants)"
  },
  "tables": {
    "ai_phrases": {
      "policy": "deterministic_all_matches",
      "policy_notes": "Every match is rewritten; one alternative chosen at runtime. Empty string '' is a valid alternative — represents the pro-drop / delete-don't-substitute pattern. Arabic prefers implicit subjects for fluff verbs, so deletion is grammatically cleaner than substitution for many AI tells.",
      "entries": [
        {"input": "من المهم ملاحظة أنه", "alternatives": ["", "ينبغي تذكُّر أن"], "source_tag": "pro_drop"},
        {"input": "ولا بد من الإشارة هنا إلى أنه", "alternatives": ["", "نشير هنا إلى أن"], "source_tag": "pro_drop"},
        {"input": "في الواقع", "alternatives": ["", "حقيقةً"], "source_tag": "pro_drop"},
        {"input": "في الحقيقة", "alternatives": ["", "حقيقةً"], "source_tag": "pro_drop"},
        {"input": "لا شك أن", "alternatives": ["", "بلا شك"], "source_tag": "pro_drop"},
        {"input": "بكل تأكيد", "alternatives": [""], "source_tag": "pro_drop"},
        {"input": "في الواقع والحقيقة", "alternatives": [""], "source_tag": "tautology_delete"},
        {"input": "من المهم ملاحظة أن", "alternatives": ["نشير إلى أن", "ثمة ما يستوجب التنبيه أن", "يلزم التنبيه إلى أن"], "source_tag": "clause_preserving"},
        {"input": "من المهم ملاحظة", "alternatives": ["نشير إلى", "يلزم التنبيه إلى"], "source_tag": "v1_substrate"},
        {"input": "من الجدير بالذكر أن", "alternatives": ["مما يُذكر أن", "ومما تجدر معرفته أن"], "source_tag": "clause_preserving"},
        {"input": "من الجدير بالذكر", "alternatives": ["ومما يُذكر", "وتجدر معرفة"], "source_tag": "v1_substrate"},
        {"input": "من المفيد الإشارة إلى", "alternatives": ["ثمة ما يستحق الإشارة إلى", "نُشير إلى"], "source_tag": "clause_preserving"},
        {"input": "في سياق متصل", "alternatives": ["وفي صلة بذلك", "وعلى صعيد متصل"], "source_tag": "v1_substrate"},
        {"input": "في نفس السياق", "alternatives": ["وفي السياق ذاته", "وعلى الصعيد نفسه"], "source_tag": "v1_substrate"},
        {"input": "علاوة على ذلك", "alternatives": ["وفوق ذلك", "ويُضاف إلى ذلك"], "source_tag": "v1_substrate"},
        {"input": "بالإضافة إلى ذلك", "alternatives": ["ويُضاف إلى ذلك", "وفوق ذلك"], "source_tag": "v1_substrate"},
        {"input": "خط أنابيب", "alternatives": ["مسار عمل", "مسار العمل", "تسلسل العمل"], "source_tag": "english_calque"},
        {"input": "خطّ أنابيب", "alternatives": ["مسار عمل", "مسار العمل"], "source_tag": "english_calque"},
        {"input": "خط الأنابيب", "alternatives": ["مسار العمل", "تسلسل العمل"], "source_tag": "english_calque"},
        {"input": "خطّ الأنابيب", "alternatives": ["مسار العمل", "تسلسل العمل"], "source_tag": "english_calque"},
        {"input": "من ناحية أخرى", "alternatives": ["وعلى صعيد آخر", "وبالمقابل"], "source_tag": "v1_substrate"},
        {"input": "على الجانب الآخر", "alternatives": ["وعلى الصعيد المقابل", "وبالمقابل"], "source_tag": "v1_substrate"},
        {"input": "في النهاية", "alternatives": ["وفي الختام", "وفي نهاية المطاف"], "source_tag": "v1_substrate"},
        {"input": "في البداية", "alternatives": ["في المبتدأ", "بادئ الأمر"], "source_tag": "v1_substrate"},
        {"input": "كما ذكر سابقاً", "alternatives": ["كما تقدّم", "كما سبق ذكره"], "source_tag": "v1_substrate"},
        {"input": "كما أسلفنا", "alternatives": ["كما تقدّم", "وفي ضوء ما تقدّم"], "source_tag": "v1_substrate"},
        {"input": "من الواضح أن", "alternatives": ["لا يخفى أن", "من البديهي أن", "بات معلوماً أن"], "source_tag": "v1_substrate"},
        {"input": "من المهم التأكيد على أن", "alternatives": ["نؤكد أن", "يجدر التأكيد على أن"], "source_tag": "clause_preserving"},
        {"input": "لا بد من الإشارة إلى أن", "alternatives": ["مما يستلزم الإشارة إليه أن", "نشير إلى أن"], "source_tag": "clause_preserving"},
        {"input": "في إطار", "alternatives": ["ضمن", "في نطاق"], "source_tag": "v1_substrate"},
        {"input": "على صعيد", "alternatives": ["في مجال", "في إطار"], "source_tag": "v1_substrate"},
        {"input": "في ظل", "alternatives": ["مع وجود", "في وقت"], "source_tag": "v1_substrate"},
        {"input": "بناءً على ما تقدم", "alternatives": ["وبناءً عليه", "وعليه"], "source_tag": "v1_substrate"},
        {"input": "جدير بالذكر أن", "alternatives": ["مما يستحق الذكر أن", "نُشير إلى أن"], "source_tag": "clause_preserving"},
        {"input": "من الممكن أن", "alternatives": ["قد", "ربما"], "source_tag": "v1_substrate"},
        {"input": "من المتوقع أن", "alternatives": ["من المرجح أن", "من المنتظر أن"], "source_tag": "v1_substrate"},
        {"input": "يشار إلى أن", "alternatives": ["نشير إلى أن", "تجدر الإشارة إلى أن"], "source_tag": "clause_preserving"},
        {"input": "يُعتبر من", "alternatives": ["يُعدّ من", "هو من"], "source_tag": "v1_substrate"},
        {"input": "في هذا الإطار", "alternatives": ["في هذا السياق", "ضمن هذا الإطار"], "source_tag": "v1_substrate"},
        {"input": "في تطور لافت", "alternatives": ["في تطوّر", ""], "source_tag": "newsroom_ai_tell"},
        {"input": "في تطور مثير", "alternatives": ["في تطوّر", ""], "source_tag": "newsroom_ai_tell"},
        {"input": "في خطوة لافتة", "alternatives": ["في خطوة", ""], "source_tag": "newsroom_ai_tell"},
        {"input": "وفي سياق متصل", "alternatives": ["كذلك", "أيضاً"], "source_tag": "newsroom_ai_tell"},
        {"input": "وضع معقّد ومتشابك", "alternatives": ["وضع معقّد"], "source_tag": "newsroom_ai_tell"},
        {"input": "وضع صعب ومعقّد", "alternatives": ["وضع صعب"], "source_tag": "newsroom_ai_tell"},
        {"input": "أزمة حادة ومستفحلة", "alternatives": ["أزمة حادة"], "source_tag": "newsroom_ai_tell"},
        {"input": "حسب ما أفادت مصادر", "alternatives": ["حسب مصادر", ""], "source_tag": "newsroom_ai_tell"},
        {"input": "قالت مصادر مطلعة", "alternatives": ["حسب مصادر", "حسب مصدر"], "source_tag": "newsroom_ai_tell"},
        {"input": "الخبراء والمراقبون", "alternatives": ["المراقبون"], "source_tag": "newsroom_ai_tell"},
        {"input": "المحللون والمراقبون", "alternatives": ["المراقبون"], "source_tag": "newsroom_ai_tell"},
        {"input": "كثير من الخبراء يرون", "alternatives": ["خبراء يرون", ""], "source_tag": "newsroom_ai_tell"},
        {"input": "العديد من المراقبين", "alternatives": ["مراقبون", ""], "source_tag": "newsroom_ai_tell"},
        {"input": "ومن المتوقع أن يَ", "alternatives": ["وقد يَ", "ربما يَ"], "source_tag": "newsroom_ai_tell"},
        {"input": "كما تَواجه", "alternatives": ["وتواجه"], "source_tag": "newsroom_ai_tell"},
        {"input": "كما يُتوقع", "alternatives": ["ويُتوقع"], "source_tag": "newsroom_ai_tell"},
        {"input": "تجدر الإشارة إلى أنّ", "alternatives": ["يُذكر أنّ", "والحقيقة أنّ", ""], "source_tag": "gap_a"},
        {"input": "تجدر الإشارة إلى أن", "alternatives": ["يُذكر أن", "والحقيقة أن", ""], "source_tag": "gap_a"},
        {"input": "في هذا الصدد", "alternatives": ["هنا", "بصدد ذلك", ""], "source_tag": "gap_a"},
        {"input": "من هذا المنطلق", "alternatives": ["من هنا", "لذلك"], "source_tag": "gap_a"},
        {"input": "على هذا الأساس", "alternatives": ["بناءً على ذلك", "لذلك"], "source_tag": "gap_a"},
        {"input": "لا شك أنّ", "alternatives": ["بلا شك", ""], "source_tag": "gap_a"},
        {"input": "من المعروف أنّ", "alternatives": ["المعروف أنّ", ""], "source_tag": "gap_a"},
        {"input": "من المعروف أن", "alternatives": ["المعروف أن", ""], "source_tag": "gap_a"},
        {"input": "كما هو معلوم", "alternatives": ["المعلوم أنّ", ""], "source_tag": "gap_a"},
        {"input": "في حقيقة الأمر", "alternatives": ["في الحقيقة"], "source_tag": "gap_a"},
        {"input": "لا يخفى على أحد", "alternatives": ["الواضح أنّ"], "source_tag": "gap_a"},
        {"input": "تجدر الإشارة كذلك", "alternatives": ["كذلك", "يُضاف"], "source_tag": "gap_a"}
      ]
    },
    "connectors": {
      "policy": "probabilistic_per_match",
      "probability": 0.7,
      "policy_notes": "Each match is replaced with probability 0.7. The remaining 0.3 are left as-is to retain variation rather than uniform stripping.",
      "entries": [
        {"input": "وعلاوة على ذلك،", "replacement": "كما أن،"},
        {"input": "ومع ذلك،", "replacement": "لكن،"},
        {"input": "وبالتالي،", "replacement": "لذلك،"},
        {"input": "وبناءً عليه،", "replacement": "لذلك،"},
        {"input": "على سبيل المثال،", "replacement": "مثلاً،"},
        {"input": "في المقابل،", "replacement": "بالمقابل،"},
        {"input": "على العكس من ذلك،", "replacement": "بعكس ذلك،"},
        {"input": "باختصار،", "replacement": "بشكل مختصر،"},
        {"input": "فضلاً عن ذلك،", "replacement": "كذلك،", "source_tag": "gap_b"},
        {"input": "إضافة إلى ذلك،", "replacement": "كذلك،", "source_tag": "gap_b"},
        {"input": "من جهة أخرى،", "replacement": "بالمقابل،", "source_tag": "gap_b"},
        {"input": "من جانب آخر،", "replacement": "بالمقابل،", "source_tag": "gap_b"},
        {"input": "بصورة عامة،", "replacement": "عموماً،", "source_tag": "gap_b"},